en,es,description,file,hash
Notes,Notas,,site/modules/Ichiban/Ichiban.module.php,f4c6f851b00d5518bf888815de279aba
Identity,Identidad,,site/modules/Ichiban/Ichiban.module.php,c9c5c65fb4af9cf90eb99b3b84424189
Used for Organization/Person JSON-LD and sameAs profile links. Leave fields empty if the identity node should stay minimal.,Se utiliza para organización/persona JSON-LD y enlaces de perfil iguales. Deje los campos vacíos si el nodo de identidad debe permanecer mínimo.,,site/modules/Ichiban/Ichiban.module.php,cde2ad3993452d48164bac03fd7ff2ea
Defaults,Valores predeterminados,,site/modules/Ichiban/Ichiban.module.php,0aabf727ab0a83c5f5d078e8b18445e0
"JSON defaults are resolved before page-level values. Use field:title, field:summary|truncate:160, custom text, or inherit.","Los valores predeterminados de JSON se resuelven antes que los valores a nivel de página. Utilice campo:título, campo:resumen|truncar:160, texto personalizado o heredar.",,site/modules/Ichiban/Ichiban.module.php,33bdc3ae43a21121f7dce26d5197dd44
Global defaults JSON,Valores predeterminados globales JSON,,site/modules/Ichiban/Ichiban.module.php,53e3b5312941b09573dc3f9186159072
Template defaults JSON,Valores predeterminados de plantilla JSON,,site/modules/Ichiban/Ichiban.module.php,5115e3fe37e3ad25f334f010f8c5b38e
"Use typed source values like field:title, field:summary|truncate:160, custom text, or inherit.","Utilice valores de origen escritos como campo:título, campo:summary|truncate:160, texto personalizado o heredar.",,site/modules/Ichiban/Ichiban.module.php,82ccb8f28eb5731a03cf696ad3f72648
Rendering,Representación,,site/modules/Ichiban/Ichiban.module.php,a6e8f9aed2ac6481dc25a18a33342d03
By default Ichiban only renders tags when your template outputs $page->seo. Automatic injection is opt-in.,"De forma predeterminada, Ichiban solo muestra etiquetas cuando su plantilla genera $page->seo. La inyección automática es opcional.",,site/modules/Ichiban/Ichiban.module.php,fb1b9b3b0133275b95ccaf96bd704d4a
Automatically inject SEO tags into page <head>,Inyecte automáticamente etiquetas SEO en la página <head>,,site/modules/Ichiban/Ichiban.module.php,55e90fc94d051339268c8cea22d211ff
Enable only if your templates do not output $page->seo.,Habilítelo solo si sus plantillas no generan $page->seo.,,site/modules/Ichiban/Ichiban.module.php,83d3719feac098415326b3ef32ef1fb2
Title Format,Formato del título,,site/modules/Ichiban/Ichiban.module.php,0c21f0be6bc0d9e2fa13c59acfa65223
"Optionally format the rendered <title>. Use {meta_title} for the resolved page title, for example {meta_title} | {site_name}. Leave blank to render the title unchanged.","Opcionalmente, formatee el <title> renderizado. Utilice {meta_title} para el título de la página resuelta, por ejemplo {meta_title} | {site_name}. Déjelo en blanco para que el título no cambie.",,site/modules/Ichiban/Ichiban.module.php,9d60b7ae07e266ce90621e229f337618
"Supported placeholders: {meta_title}, {site_name}, {entity_name}, {host}. Title length checks include this format.","Marcadores de posición admitidos: {meta_title}, {site_name}, {entity_name}, {host}. Las comprobaciones de la longitud del título incluyen este formato.",,site/modules/Ichiban/Ichiban.module.php,08debe1ddbe5e86837f27f89a8b4c15d
Render hreflang alternate links,Representar enlaces alternativos de hreflang,,site/modules/Ichiban/Ichiban.module.php,dd27ad837fa55751efc91ce4322806d2
Disable this when ProcessWire languages are used internally but the public site should not advertise language alternates.,Desactívelo cuando los idiomas de ProcessWire se utilicen internamente pero el sitio público no deba anunciar idiomas alternativos.,,site/modules/Ichiban/Ichiban.module.php,a0f50a879725bc755d76fcc71dbebc9c
Render JSON-LD schema,Representar el esquema JSON-LD,,site/modules/Ichiban/Ichiban.module.php,093f286865020e6e4762d54b968f4e18
Disable this when templates or another module generate custom structured data.,Desactívelo cuando las plantillas u otro módulo generen datos estructurados personalizados.,,site/modules/Ichiban/Ichiban.module.php,4c61b25b55b63f2ab8fa34b40ae0d612
Webmaster Verification,Verificación de webmaster,,site/modules/Ichiban/Ichiban.module.php,e16aace7feb4c4c815b9f9acbf072815
Verification tags and Meta Pixel are rendered on the home page only. Google Search Console verification is intentionally omitted here because current Google setup should use DNS TXT or CNAME verification.,Las etiquetas de verificación y Meta Pixel se muestran únicamente en la página de inicio. La verificación Google Search Console se omite intencionalmente aquí porque la configuración actual de Google debe usar verificación DNS TXT o CNAME.,,site/modules/Ichiban/Ichiban.module.php,a9c50cdbf2ad228624b2017ab78c7438
"Microsoft Bing, Yahoo, and DuckDuckGo visibility often starts from Bing Webmaster Tools.","La visibilidad de Microsoft Bing, Yahoo y DuckDuckGo a menudo comienza desde Bing Webmaster Tools.",,site/modules/Ichiban/Ichiban.module.php,fbe1774e9a77f9f92b4b96bf4c64585a
Yandex meta verification token.,Token de metaverificación de Yandex.,,site/modules/Ichiban/Ichiban.module.php,76f540135e80a474de70e3583a54dc45
China: renders baidu-site-verification meta tag.,China: muestra la metaetiqueta baidu-site-verification.,,site/modules/Ichiban/Ichiban.module.php,a95ed1f87dde1518d8b49008ebb77dbb
China: renders sogou_site_verification meta tag.,China: representa la metaetiqueta sogou_site_verification.,,site/modules/Ichiban/Ichiban.module.php,9d4aa8d584f94eac913b6201afac6730
China: renders 360-site-verification meta tag.,China: muestra metaetiqueta de verificación de sitios 360.,,site/modules/Ichiban/Ichiban.module.php,d0a0430a9f737934f21aa4303c7edab1
Pinterest domain verification token.,Token de verificación de dominio de Pinterest.,,site/modules/Ichiban/Ichiban.module.php,eacbd24ca94cad724c6f391d472638ba
Meta domain verification token.,Token de verificación de metadominio.,,site/modules/Ichiban/Ichiban.module.php,db13ec584f9633e6751535d17824e79e
Numeric Pixel ID. Renders the standard PageView pixel on the home page.,ID de píxel numérico. Representa el píxel estándar de PageView en la página de inicio.,,site/modules/Ichiban/Ichiban.module.php,9219a1dab2e3eebf88becf2f14e80d01
Additional verification meta tags,Metaetiquetas de verificación adicionales,,site/modules/Ichiban/Ichiban.module.php,e7d88f3cf0b8b671959e10fe014e8fd2
One per line as meta-name=token. Use for regional tools that provide a meta verification tag.,Uno por línea como meta-nombre=token. Úselo para herramientas regionales que proporcionan una etiqueta de metaverificación.,,site/modules/Ichiban/Ichiban.module.php,76f0c578ce00ff37d7e990f91b0953d3
Example: example-site-verification=abc123. Only simple meta names are rendered.,Ejemplo: ejemplo-sitio-verificación=abc123. Sólo se representan metanombres simples.,,site/modules/Ichiban/Ichiban.module.php,3cd39c0bf9c68bf909c01310e7dfa0ef
Google Search Console,Google Search Console,,site/modules/Ichiban/Ichiban.module.php,4243784eac7728b8e6339bdafe240e01
"Enable the Google Search Console API, create an OAuth Web application client, add this authorized redirect URI: %s, publish the OAuth app to production, then paste the Client ID and Client Secret below. Existing tokens are preserved when settings are saved.","Habilite Google Search Console API, cree un cliente de aplicación web OAuth, agregue este URI de redireccionamiento autorizado: %s, publique la aplicación OAuth en producción y luego pegue el ID del cliente y el secreto del cliente a continuación. Los tokens existentes se conservan cuando se guarda la configuración.",,site/modules/Ichiban/Ichiban.module.php,43a85ff63755f87a7ccd5056ba6c38c6
Connection status,Estado de conexión,,site/modules/Ichiban/Ichiban.module.php,1714ef7e843e7735ce68bebe872f33e5
Access token expires %s.,El token de acceso caduca %s.,,site/modules/Ichiban/Ichiban.module.php,ba85dd89d299ed46b9c8a5948542f99c
Access token expired; refresh token is saved.,El token de acceso expiró; El token de actualización se guarda.,,site/modules/Ichiban/Ichiban.module.php,f3802e32cd6d09d7c1af945c4f5943d6
Client ID saved,ID de cliente guardado,,site/modules/Ichiban/Ichiban.module.php,1de31a3258bc607d52b41ee216c7d72f
Client Secret saved,Secreto de cliente guardado,,site/modules/Ichiban/Ichiban.module.php,42b44c19ef8327c019c9ad9f78d67aee
Google account connected,Cuenta de Google conectada,,site/modules/Ichiban/Ichiban.module.php,d760203bbcc492353c8b31b14d9ffbf7
Open Insights,Información abierta,,site/modules/Ichiban/Ichiban.module.php,7f1baa2a21ced2b2e130215f4bafd5f4
"Enter the Search Console domain, for example lqrs.uk. Ichiban will query it as a Domain property. You can still enter a URL-prefix property like https://example.com/ when needed.","Ingrese el dominio Search Console, por ejemplo lqrs.uk. Ichiban lo consultará como propiedad de dominio. Aún puede ingresar una propiedad de prefijo URL como https://example.com/ cuando sea necesario.",,site/modules/Ichiban/Ichiban.module.php,239ee60095ca0138f335744cf3894216
Examples: lqrs.uk or https://example.com/,Ejemplos: lqrs.uk o https://example.com/,,site/modules/Ichiban/Ichiban.module.php,c5841c295217e694ae9814ae1de70f4e
Backlinks / Moz API,Vínculos de retroceso / Moz API,,site/modules/Ichiban/Ichiban.module.php,148a3c9e93041db9e3a92077aa62487a
"Moz Links API is used by the Backlinks section for inbound links, linking root domains, and anchor text. Use the new Moz API token when possible; legacy Access ID and Secret Key are only a fallback. Start with a small row limit to control monthly usage.","Enlaces Moz API es utilizado por la sección Vínculos de retroceso para enlaces entrantes, enlaces de dominios raíz y texto de anclaje. Utilice el nuevo token Moz API cuando sea posible; El ID de acceso y la clave secreta heredados son solo una alternativa. Comience con un límite de filas pequeño para controlar el uso mensual.",,site/modules/Ichiban/Ichiban.module.php,3934fe34546dadc9006bc189343d76f2
Default target,Objetivo predeterminado,,site/modules/Ichiban/Ichiban.module.php,b9fa8d034ac4e37eaf215fe66737b851
Moz API token,Ficha Moz API,,site/modules/Ichiban/Ichiban.module.php,607e064d5ce603ed00fcaf852c19c94b
Legacy Moz Access ID,ID de acceso heredado Moz,,site/modules/Ichiban/Ichiban.module.php,9b8ce27d60235026df35f7d5cbca4530
Legacy Moz Secret Key,Clave secreta heredada Moz,,site/modules/Ichiban/Ichiban.module.php,c8ee8763358100831a05c85657874e72
Moz API base URL,Moz API base URL,,site/modules/Ichiban/Ichiban.module.php,3a6253c05602eb8d3bd204c6116b429d
Rows per request,Filas por solicitud,,site/modules/Ichiban/Ichiban.module.php,ad470cb6dbb8dc939f06c96e7b0ab4fb
Used by the Backlinks preview tables.,Utilizado por las tablas de vista previa de vínculos de retroceso.,,site/modules/Ichiban/Ichiban.module.php,7c7dd953919a36c2613a5cbdb05ce96c
Timeout (sec),Tiempo de espera (seg.),,site/modules/Ichiban/Ichiban.module.php,ef8e3c27bc823b5dcf6164fb9f2823de
AI / OpenRouter,AI / OpenRouter,,site/modules/Ichiban/Ichiban.module.php,352d399e1a48f6097e5ba56506f05233
"OpenRouter connection used by the Ichiban AI section. This follows the same OpenAI-compatible pattern as the Context module: provider, API key, model, limits, and OpenRouter attribution headers.","Conexión OpenRouter utilizada por la sección Ichiban AI. Sigue el mismo patrón compatible con OpenAI que el módulo Contexto: proveedor, clave API, modelo, límites y encabezados de atribución OpenRouter.",,site/modules/Ichiban/Ichiban.module.php,cfc3cf84b322e9ae90482456eeb3bd38
Enable AI features,Habilitar funciones AI,,site/modules/Ichiban/Ichiban.module.php,3148562cec18808d8b30b9ee29e0f94e
Provider,Proveedor,,site/modules/Ichiban/Ichiban.module.php,27703c8f150ac4bb0a3a83a7857353af
OpenRouter API key,Tecla OpenRouter API,,site/modules/Ichiban/Ichiban.module.php,3f887aa03ecf4b1f9927b54999f9f425
Get a key at openrouter.ai/keys.,Obtenga una clave en openrouter.ai/keys.,,site/modules/Ichiban/Ichiban.module.php,4737a7f3850d0474f3335ad3d0f213fa
Default model,Modelo predeterminado,,site/modules/Ichiban/Ichiban.module.php,b8821dd93fc369a07b7e9be00bd71b10
"OpenRouter format: provider/model, for example anthropic/claude-sonnet-4-6 or openai/gpt-4o-mini.","Formato OpenRouter: proveedor/modelo, por ejemplo anthropic/claude-sonnet-4-6 o openai/gpt-4o-mini.",,site/modules/Ichiban/Ichiban.module.php,f14be682d566283dc93e3af760bc8720
Max tokens,Fichas máximas,,site/modules/Ichiban/Ichiban.module.php,ebd6c027329f58c7a56ddb68035e623a
Temperature,Temperatura,,site/modules/Ichiban/Ichiban.module.php,ee7a8e262285ed49ea1b4e4ae11525bd
"0 = deterministic, 1 = more creative.","0 = determinista, 1 = más creativo.",,site/modules/Ichiban/Ichiban.module.php,e9c19aa21f310410427aed8cf273ee5e
Global system prompt,Aviso del sistema global,,site/modules/Ichiban/Ichiban.module.php,dc80dfae1022d8c1f3a4424589c3947f
Prepended to Ichiban AI requests.,Antepuesto a las solicitudes Ichiban AI.,,site/modules/Ichiban/Ichiban.module.php,ac60eb790e862f3f993590931849b81f
You are a helpful SEO assistant for ProcessWire websites.,Eres un útil asistente SEO para los sitios web ProcessWire.,,site/modules/Ichiban/Ichiban.module.php,75146a303e87f5716fce1a6a506185cf
Site URL (OpenRouter attribution),Sitio URL (atribución OpenRouter),,site/modules/Ichiban/Ichiban.module.php,24d92b3277066f6e0f59081c85224a28
Sent as HTTP-Referer header.,Enviado como encabezado HTTP-Referer.,,site/modules/Ichiban/Ichiban.module.php,abdfdf90ffdff8c9d2aa53a5e0c0e5ae
Site / app name (OpenRouter attribution),Nombre del sitio/aplicación (atribución OpenRouter),,site/modules/Ichiban/Ichiban.module.php,42adc4749d3e4cad8dab5d6caaefb002
Sent as X-Title header.,Enviado como encabezado X-Title.,,site/modules/Ichiban/Ichiban.module.php,d5d1de4439d5925614911c6ece8274dd
Publishing & URLs,Publicación y URLs,,site/modules/Ichiban/Ichiban.module.php,86c81580cb61ca8b8b36e1eb8791e413
"IndexNow keys are simple verification strings, not keys from an account. Generate one here or use any 8-128 character key containing letters, numbers, and hyphens. A public key file named {key}.txt must exist at the site root and contain the key.","Las claves IndexNow son cadenas de verificación simples, no claves de una cuenta. Genere una aquí o utilice cualquier clave de 8 a 128 caracteres que contenga letras, números y guiones. Debe existir un archivo de clave pública denominado {key}.txt en la raíz del sitio y contener la clave.",,site/modules/Ichiban/Ichiban.module.php,6ba02b19032039de34d471bc54d181ad
Current key file URL: %s,Archivo de clave actual URL: %s,,site/modules/Ichiban/Ichiban.module.php,f3fa4b8b953f520859f0c214f66d9bae
Index Now API Key,Índice ahora Clave API,,site/modules/Ichiban/Ichiban.module.php,cf092d7f265535840a7191bfcde56ce6
Used when Ichiban pings IndexNow after a public page is saved.,Se utiliza cuando Ichiban hace ping a IndexNow después de guardar una página pública.,,site/modules/Ichiban/Ichiban.module.php,b84b5ee761e789d69ce9c7be24f60152
Click Save to write/update the public key file if the site root is writable.,Haga clic en Guardar para escribir/actualizar el archivo de clave pública si se puede escribir en la raíz del sitio.,,site/modules/Ichiban/Ichiban.module.php,d41067de431a8f0e6afc4d55afe9a674
Twitter/X Site Handle (global default),Identificador del sitio Twitter/X (predeterminado global),,site/modules/Ichiban/Ichiban.module.php,ad9fdbcb00b1dd7da69fbcdf723973f4
Example: @example,Ejemplo: @ejemplo,,site/modules/Ichiban/Ichiban.module.php,554f29fd1e15440cc34dbaa8a1b3cadc
URL segments in SEO URLs,Segmentos URL en SEO URLs,,site/modules/Ichiban/Ichiban.module.php,9556ac4044ecb6e06b7b429847b0a7ab
"Controls canonical, og:url, twitter:url, and hreflang on pages that use ProcessWire URL segments.","Controla canonical, og:url, twitter:url y hreflang en páginas que utilizan segmentos ProcessWire URL.",,site/modules/Ichiban/Ichiban.module.php,17b32f4acfd38a4071740901071cc050
Preserve current URL segments,Preservar los segmentos actuales URL,,site/modules/Ichiban/Ichiban.module.php,83d8e9e795d8952cd83396209ba9a48f
Collapse to the page URL,Contraer a la página URL,,site/modules/Ichiban/Ichiban.module.php,fe2bdcd2792e9da25e6ea86d111b4c97
Sitemap,Mapa del sitio,,site/modules/Ichiban/Ichiban.module.php,5813ce0ec7196c492c97596718f71969
Public index: %s. Use the Sitemap tab for generation status and manual actions.,Índice público: %s. Utilice la pestaña Mapa del sitio para conocer el estado de generación y las acciones manuales.,,site/modules/Ichiban/Ichiban.module.php,55b9475f53a07c7d5196f4c71a398dbb
Enable XML sitemap,Habilitar mapa del sitio XML,,site/modules/Ichiban/Ichiban.module.php,569a85acaf40ac1f92443e0decb42c95
Sitemap directory,Directorio del mapa del sitio,,site/modules/Ichiban/Ichiban.module.php,b0f475614b773ce993fe45c9ef8b6329
Relative to the ProcessWire web root.,Relativo a la raíz web ProcessWire.,,site/modules/Ichiban/Ichiban.module.php,ba69c62563d8fcaa5bc70e618ad9686c
URLs per file,URLs por archivo,,site/modules/Ichiban/Ichiban.module.php,ae11a7f6039f458bb3417a74af2a2a22
Respect noindex,Respetar no index,,site/modules/Ichiban/Ichiban.module.php,42daa8924f722774b292a26353574ae1
Include hidden pages,Incluir páginas ocultas,,site/modules/Ichiban/Ichiban.module.php,42fdbb35b46ad8e66130cc690f8d2e84
Include unpublished pages,Incluir páginas inéditas,,site/modules/Ichiban/Ichiban.module.php,f10bf91385c456e865e24520b8c3249a
Include image entries,Incluir entradas de imágenes,,site/modules/Ichiban/Ichiban.module.php,bae90c7f5f8ba4caf46f4d33748af032
Include hreflang alternates,Incluir alternativas de hreflang,,site/modules/Ichiban/Ichiban.module.php,a3f0a766c142dca615feb89b2fcf8e4f
Auto-regenerate with LazyCron,Regeneración automática con LazyCron,,site/modules/Ichiban/Ichiban.module.php,f395869cfdc0ad94b539257b0822f0b9
Default priority,Prioridad predeterminada,,site/modules/Ichiban/Ichiban.module.php,1ebbf846450960ea27ce5d8a47e2ee28
Default change frequency,Frecuencia de cambio predeterminada,,site/modules/Ichiban/Ichiban.module.php,7c7455bca9481ec96e91524395bd37a6
Homepage priority,Prioridad de la página de inicio,,site/modules/Ichiban/Ichiban.module.php,49e0d8d486d9112f21ba54742fe55be5
Homepage change frequency,Frecuencia de cambio de página de inicio,,site/modules/Ichiban/Ichiban.module.php,c7e60025101e69e09853c4ac2718519b
Only include templates,Solo incluye plantillas,,site/modules/Ichiban/Ichiban.module.php,950bad0a29a72ff00fb288b1f071d3ca
Exclude templates,Excluir plantillas,,site/modules/Ichiban/Ichiban.module.php,c7ea296376dd22a7d17f04efffe8ed27
Lastmod date format,Formato de fecha de última modificación,,site/modules/Ichiban/Ichiban.module.php,31f0035ae8deafc50c1a884e22a2c851
Regenerate interval seconds,Regenerar segundos de intervalo,,site/modules/Ichiban/Ichiban.module.php,6b7ef7337d0424ec1eaae0becea77bc2
Exclude URL patterns,Excluir patrones URL,,site/modules/Ichiban/Ichiban.module.php,7b2a2bf0e015b564de9d30ec757db7cc
One substring or regex per line.,Una subcadena o expresión regular por línea.,,site/modules/Ichiban/Ichiban.module.php,205b33cf81fcdb5e601655a6dfdd6641
Custom URLs,Personalizado URLs,,site/modules/Ichiban/Ichiban.module.php,ab6d16c877b80ef4bcaa140978b45722
"One CSV row per URL: loc,lastmod,changefreq,priority. JSON array is also accepted.","Una fila CSV por URL: loc,lastmod,changefreq,priority. También se acepta la matriz JSON.",,site/modules/Ichiban/Ichiban.module.php,cd635d3759f05d2a6653958ea84baa87
Actions,Acciones,,site/modules/Ichiban/Ichiban.module.php,06df33001c1d7187fdd81ea1f5b277aa
Open Sitemap dashboard,Abrir el panel del mapa del sitio,,site/modules/Ichiban/Ichiban.module.php,b61224e27f0e9c1e2ea56427ab9df646
Open sitemap.xml,Abrir mapa del sitio.xml,,site/modules/Ichiban/Ichiban.module.php,e22314499074693a6db3ad3ad84009d7
robots.txt / llms.txt,robots.txt / llms.txt,,site/modules/Ichiban/Ichiban.module.php,f7f3595cfd911fe0f32b2d5ed2d6ec94
"RobotsTxt companion module is installed. Use Setup > Robots.txt for the physical robots.txt editor and presets, or enable Ichiban robots.txt only when you want Ichiban to serve it dynamically. Avoid managing robots.txt in both places at once.","El módulo complementario RobotsTxt está instalado. Utilice Configuración > Robots.txt para el editor físico de robots.txt y los ajustes preestablecidos, o habilite Ichiban robots.txt solo cuando desee que Ichiban lo entregue dinámicamente. Evite administrar robots.txt en ambos lugares a la vez.",,site/modules/Ichiban/Ichiban.module.php,61485a8a151dfd94bbad3951bd85db78
"Install the companion RobotsTxt module if you want a full physical robots.txt editor with presets, rules overview, file status, and a View file action. Ichiban can still serve a simple dynamic robots.txt when enabled below.","Instale el módulo complementario RobotsTxt si desea un editor físico completo de robots.txt con ajustes preestablecidos, descripción general de reglas, estado de archivo y una acción Ver archivo. Ichiban aún puede publicar un archivo robots.txt dinámico simple cuando se habilita a continuación.",,site/modules/Ichiban/Ichiban.module.php,8ce9d35f1632ad55a9b6fb6c83fdea06
Open Robots.txt editor,Abrir el editor Robots.txt,,site/modules/Ichiban/Ichiban.module.php,ebbcbe25e55e17e08420c46e56b9b72b
Open robots.txt,Abrir robots.txt,,site/modules/Ichiban/Ichiban.module.php,6319ecca224596dd462c8d70e5de251e
Serve robots.txt from Ichiban,Servir robots.txt desde Ichiban,,site/modules/Ichiban/Ichiban.module.php,3adf7437341bc34c9a419562a915cb4b
robots.txt content,contenido robots.txt,,site/modules/Ichiban/Ichiban.module.php,06007cedde4f915ae8a13b0bbce0565f
Ichiban appends Sitemap automatically when no Sitemap line is present.,Ichiban agrega el mapa del sitio automáticamente cuando no hay ninguna línea del mapa del sitio.,,site/modules/Ichiban/Ichiban.module.php,74650062ba06bfbf447668866a3a3760
Serve llms.txt from Ichiban,Servir llms.txt desde Ichiban,,site/modules/Ichiban/Ichiban.module.php,3df918c49ac03e882a2eee6e1b2f3377
llms.txt mode,modo llms.txt,,site/modules/Ichiban/Ichiban.module.php,80c866323cb12b94221dff80bb9cf554
Auto,Automático,,site/modules/Ichiban/Ichiban.module.php,06b9281e396db002010bde1de57262eb
Manual,manuales,,site/modules/Ichiban/Ichiban.module.php,e1ba155a9f2e8c3be94020eef32a0301
Auto mode templates,Plantillas de modo automático,,site/modules/Ichiban/Ichiban.module.php,25ee8a7254ee5db849a6b5e5255e4b18
Comma-separated template names. Leave empty for all published pages.,Nombres de plantillas separados por comas. Déjelo vacío para todas las páginas publicadas.,,site/modules/Ichiban/Ichiban.module.php,74cf4d53a6a97044875cad78893856fa
Manual llms.txt lines,Líneas manuales llms.txt,,site/modules/Ichiban/Ichiban.module.php,c65f8a4c0f1b072037bcd4e12d6ead1c
One Markdown link or plain URL per line.,Un enlace Markdown o URL simple por línea.,,site/modules/Ichiban/Ichiban.module.php,dba285a1c9da947474171d57c08d9f74
Crawl & Search Cleanup,Limpieza de rastreo y búsqueda,,site/modules/Ichiban/Ichiban.module.php,2f33b05b959e88dac60b3ade4c27982c
Use cleanup options carefully on production. Blocked search queries are recorded in the Cleanup log.,Utilice las opciones de limpieza con cuidado en producción. Las consultas de búsqueda bloqueadas se registran en el registro de limpieza.,,site/modules/Ichiban/Ichiban.module.php,25f9bdac879109e698c3eeea78382965
Block spam search queries,Bloquear consultas de búsqueda no deseadas,,site/modules/Ichiban/Ichiban.module.php,3ca11db7ae6adf6b9fc55bf1e49f9111
Remove RSD link,Eliminar enlace RSD,,site/modules/Ichiban/Ichiban.module.php,e78db2fa2f930ca7eb95d4fe519b1079
Remove WLW manifest,Eliminar el manifiesto WLW,,site/modules/Ichiban/Ichiban.module.php,af4faf4b93a20e008a2a44d6afda6e5e
Remove shortlink,Eliminar enlace corto,,site/modules/Ichiban/Ichiban.module.php,fba5ed320cbabb98e15b1d51ee8917b5
Remove prev/next links,Eliminar enlaces anteriores/siguientes,,site/modules/Ichiban/Ichiban.module.php,11e2216ecf0699ef40a37d563256f587
Remove generator meta,Eliminar meta del generador,,site/modules/Ichiban/Ichiban.module.php,da6d4ea0cd2bf158595a2f0e44c0afcb
Blocked query action,Acción de consulta bloqueada,,site/modules/Ichiban/Ichiban.module.php,84eea49868e62884a2b1691d7cddcdc1
Redirect to homepage,Redirigir a la página de inicio,,site/modules/Ichiban/Ichiban.module.php,0499b7aaa6d121d7bece90c4109317b2
Return 400,Devolver 400,,site/modules/Ichiban/Ichiban.module.php,d7c0a219f529812b6e4b637d7b61475f
Custom block regex patterns,Patrones de expresiones regulares de bloques personalizados,,site/modules/Ichiban/Ichiban.module.php,2a055d063bf3d4633b9178510c96e149
One regular expression per line.,Una expresión regular por línea.,,site/modules/Ichiban/Ichiban.module.php,711561b4befca537ab5d6186def421ed
Dashboard,Panel de control,,site/modules/Ichiban/ProcessIchiban.module.php,2938c7f7e560ed972f8a4f68e80ff834
SEO Dashboard,Panel de control SEO,,site/modules/Ichiban/ProcessIchiban.module.php,9f4d395b3e4af46f092a4b462b8ea473
"A quick overview of metadata health, crawl cleanup activity, redirects, and recent SEO changes.","Una descripción general rápida del estado de los metadatos, la actividad de limpieza de rastreo, las redirecciones y los cambios recientes en SEO.",,site/modules/Ichiban/ProcessIchiban.module.php,5ded7cfc24996854da04760043ba6190
Open Audit,Auditoría abierta,,site/modules/Ichiban/ProcessIchiban.module.php,d696bd75a309953bf613eb851cdee09a
Site SEO Score,Puntuación del sitio SEO,,site/modules/Ichiban/ProcessIchiban.module.php,3e37d6888c657624030bcc638dadcc13
Review score,Puntuación de revisión,,site/modules/Ichiban/ProcessIchiban.module.php,416798f0b25aeb1beb087b8a33e932a5
